{
  "schemaVersion": 1,
  "planId": "maple-island-full-mvp",
  "title": "Full Maple Island MVP",
  "category": "questline",
  "priority": "high",
  "status": "draft",
  "objectiveMode": "ordered-with-live-quest-validation",
  "focusPolicy": {
    "focusLevel": "locked",
    "allowSidetracks": false,
    "allowedSidetrackTypes": ["emergency"],
    "returnToPlan": "always"
  },
  "entryCriteria": {
    "requiredStartMapId": 10000,
    "requiredRegion": "maple-island",
    "requiredCharacterState": "clean-lv1-start"
  },
  "exitCriteria": {
    "completeWhen": "all-selected-maple-island-quests-and-southperry-arrival-verified",
    "finalMapId": 2000000,
    "startOnlyQuestIds": [1046],
    "blockedCompletedQuestIds": [1018, 1028],
    "forbiddenActions": [
      {
        "type": "npc-travel",
        "npcId": 22000,
        "npcName": "Shanks",
        "reason": "Quest interaction is allowed, but transport off Maple Island is forbidden."
      },
      {
        "type": "map-travel",
        "mapId": 104000000,
        "reason": "Lith Harbor is outside the Maple Island MVP."
      }
    ]
  },
  "questPolicy": {
    "requiredQuestIds": [
      1008, 1009, 1010, 1011, 1012, 1013, 1014, 1015, 1020, 1021,
      1031, 1032, 1033, 1034, 1035, 1036, 1037, 1038, 1039, 1040,
      1041, 1042, 1043, 1044, 1045, 1046
    ],
    "excludedQuestIds": [
      1000, 1001, 1003, 1004, 1005, 1006, 1007, 1016, 1017, 1018,
      1019, 1022, 1025, 1026, 1027, 1028, 1029, 1030, 8031, 8142
    ]
  },
  "route": [
    {
      "mapId": 10000,
      "label": "Mushroom Town",
      "objectives": [
        { "kind": "quest-chain", "questIds": [1031], "npcIds": [2101, 2100] }
      ]
    },
    {
      "mapId": 20000,
      "label": "Snail Garden",
      "objectives": [
        { "kind": "quest-start", "questId": 1021, "npcId": 2000 },
        { "kind": "use-item", "itemId": 2010007, "forQuestId": 1021 },
        { "kind": "quest-complete", "questId": 1021, "npcId": 2000 }
      ]
    },
    {
      "mapId": 30000,
      "label": "Snail Field of Flowers",
      "objectives": [
        { "kind": "quest-start", "questId": 1032, "npcId": 2102 }
      ]
    },
    {
      "mapId": 30001,
      "label": "Mushroom Town Townstreet",
      "objectives": [
        { "kind": "quest-complete", "questId": 1032, "npcId": 2001 },
        { "kind": "quest-start", "questId": 1033, "npcId": 2001 }
      ]
    },
    {
      "mapId": 30000,
      "label": "Snail Field of Flowers",
      "objectives": [
        { "kind": "quest-complete", "questId": 1033, "npcId": 2102 },
        { "kind": "quest-start", "questId": 1034, "npcId": 2102 }
      ]
    },
    {
      "mapId": 30001,
      "label": "Mushroom Town Townstreet",
      "objectives": [
        { "kind": "quest-complete", "questId": 1034, "npcId": 2001 }
      ]
    },
    {
      "mapId": 40000,
      "label": "Mushroom Town Training Ground",
      "objectives": [
        { "kind": "quest-start", "questId": 1035, "npcId": 2004 },
        { "kind": "kill-mobs", "forQuestId": 1035, "mobIds": [9300018], "counts": [1], "itemIds": [4031802] },
        { "kind": "quest-complete", "questId": 1035, "npcId": 2002 }
      ]
    },
    {
      "mapId": 50000,
      "label": "Dangerous Forest",
      "objectives": [
        { "kind": "quest-chain", "questIds": [1036], "npcId": 2003 },
        { "kind": "quest-start", "questId": 1037, "npcId": 2005 },
        { "kind": "kill-mobs", "forQuestId": 1037, "mobIds": [100100], "counts": [10] }
      ]
    },
    {
      "mapId": 1000000,
      "label": "Amherst",
      "objectives": [
        { "objectiveId": "r008-rain-1009-quest-chain", "kind": "quest-chain", "questIds": [1009], "npcId": 12101 },
        { "objectiveId": "r008-rain-1010-quest-chain", "kind": "quest-chain", "questIds": [1010], "npcId": 12101 },
        { "objectiveId": "r008-rain-1011-quest-chain", "kind": "quest-chain", "questIds": [1011], "npcId": 12101 },
        { "objectiveId": "r008-rain-1012-quest-chain", "kind": "quest-chain", "questIds": [1012], "npcId": 12101 },
        { "objectiveId": "r008-rain-1013-quest-chain", "kind": "quest-chain", "questIds": [1013], "npcId": 12101 },
        { "objectiveId": "r008-rain-1014-quest-chain", "kind": "quest-chain", "questIds": [1014], "npcId": 12101 },
        { "objectiveId": "r008-rain-1015-quest-chain", "kind": "quest-chain", "questIds": [1015], "npcId": 12101 },
        { "objectiveId": "r008-o009-quest-start", "kind": "quest-start", "questId": 1008, "npcId": 10000 },
        { "objectiveId": "r008-o010-reactor-hit", "kind": "reactor-hit", "forQuestId": 1008, "npcId": 10000, "mode": "hit" },
        { "objectiveId": "r008-o011-reactor-box-items", "kind": "reactor-box-items", "forQuestId": 1008, "itemIds": [4031161, 4031162] },
        { "objectiveId": "r008-o012-quest-complete", "kind": "quest-complete", "questId": 1008, "npcId": 10000 },
        { "objectiveId": "r008-o013-quest-chain", "kind": "quest-chain", "questIds": [1020], "npcId": 10000 },
        { "objectiveId": "r008-o000-quest-complete", "kind": "quest-complete", "questId": 1037, "npcId": 2103 },
        { "objectiveId": "r008-o001-quest-chain", "kind": "quest-chain", "questIds": [1038], "npcIds": [2103, 12000] },
        { "kind": "quest-start", "questId": 1040, "npcId": 12000 }
      ]
    },
    {
      "mapId": 1010000,
      "label": "Entrance to Adventurer Training Center",
      "objectives": [
        { "kind": "quest-start", "questId": 1039, "npcId": 20100 },
        { "kind": "kill-mobs", "forQuestId": 1039, "mobIds": [100101, 120100], "counts": [10, 10] },
        { "kind": "quest-complete", "questId": 1039, "npcId": 20100 },
        { "kind": "quest-start", "questId": 1041, "npcId": 12100 }
      ]
    },
    {
      "mapId": 1010100,
      "label": "Mai's First Training Ground",
      "objectives": [
        { "kind": "kill-mobs", "forQuestId": 1041, "mobIds": [130100], "counts": [5], "itemIds": [4000003, 4000003, 4000003] }
      ]
    },
    {
      "mapId": 1010000,
      "label": "Entrance to Adventurer Training Center",
      "objectives": [
        { "kind": "quest-complete", "questId": 1041, "npcId": 12100 },
        { "kind": "quest-start", "questId": 1042, "npcId": 12100 }
      ]
    },
    {
      "mapId": 1010200,
      "label": "Mai's Second Training Ground",
      "objectives": [
        { "kind": "kill-mobs", "forQuestId": 1042, "mobIds": [130101], "counts": [5] }
      ]
    },
    {
      "mapId": 1010000,
      "label": "Entrance to Adventurer Training Center",
      "objectives": [
        { "kind": "quest-complete", "questId": 1042, "npcId": 12100 },
        { "kind": "quest-start", "questId": 1043, "npcId": 12100 }
      ]
    },
    {
      "mapId": 1010300,
      "label": "Mai's Third Training Ground",
      "objectives": [
        { "kind": "kill-mobs", "forQuestId": 1043, "mobIds": [210100], "counts": [3], "itemIds": [4000004] }
      ]
    },
    {
      "mapId": 1010000,
      "label": "Entrance to Adventurer Training Center",
      "objectives": [
        { "kind": "quest-complete", "questId": 1043, "npcId": 12100 },
        { "kind": "quest-start", "questId": 1044, "npcId": 12100 }
      ]
    },
    {
      "mapId": 1010400,
      "label": "Mai's Final Training Ground",
      "objectives": [
        { "kind": "kill-mobs", "forQuestId": 1044, "mobIds": [9500102], "counts": [2] }
      ]
    },
    {
      "mapId": 1010000,
      "label": "Entrance to Adventurer Training Center",
      "objectives": [
        { "kind": "quest-complete", "questId": 1044, "npcId": 12100 }
      ]
    },
    {
      "mapId": 1000000,
      "label": "Amherst",
      "objectives": [
        { "kind": "quest-complete", "questId": 1040, "npcId": 12000 }
      ]
    },
    {
      "mapId": 1010000,
      "label": "Entrance to Adventurer Training Center",
      "objectives": [
        { "kind": "quest-start", "questId": 1045, "npcId": 20001 },
        { "kind": "kill-mobs", "forQuestId": 1045, "mobIds": [1210102], "counts": [1], "itemIds": [4000001] },
        { "kind": "quest-complete", "questId": 1045, "npcId": 20001 }
      ]
    },
    {
      "mapId": 2000000,
      "label": "Southperry",
      "objectives": [
        { "kind": "quest-start", "questId": 1046, "npcId": 20002 },
        { "kind": "stop-plan", "mode": "southperry-right-relaxer", "reason": "Full Maple Island MVP complete; Biggs's Story remains active for Victoria Island." }
      ]
    }
  ]
}
