{
  "schemaVersion": 1,
  "planId": "maple-island-amherst-subphase",
  "title": "Maple Island Amherst Sub-phase MVP",
  "category": "questline",
  "priority": "high",
  "status": "draft",
  "objectiveMode": "ordered-with-live-quest-validation",
  "focusPolicy": {
    "focusLevel": "locked",
    "allowSidetracks": false,
    "allowedSidetrackTypes": ["emergency"],
    "returnToPlan": "always"
  },
  "entryCriteria": {
    "requiredStartMapId": 10000,
    "requiredRegion": "maple-island",
    "requiredCharacterState": "clean-lv1-start"
  },
  "exitCriteria": {
    "completeWhen": "all-required-objectives-cleared",
    "finalMapId": 1000000,
    "blockedCompletedQuestIds": [1018, 1028],
    "forbiddenActions": [
      {
        "type": "npc-travel",
        "npcId": 22000,
        "npcName": "Shanks",
        "reason": "Stop at Amherst and do not leave Maple Island."
      },
      {
        "type": "map-travel",
        "mapId": 1010000,
        "reason": "Training Center and later Maple Island maps are outside this sub-phase."
      }
    ]
  },
  "catalogHints": {
    "catalogClass": "server.agents.capabilities.quest.AmherstQuestCatalog",
    "scopePolicyClass": "server.agents.capabilities.quest.AmherstScopePolicy",
    "sequenceDoc": "docs/agents/MAPLE_ISLAND_AMHERST_SUBPHASE_MVP.md",
    "testPlanDoc": "docs/agents/MAPLE_ISLAND_AMHERST_SUBPHASE_TEST_PLAN.md"
  },
  "questPolicy": {
    "requiredQuestIds": [
      1008, 1009,
      1010, 1011, 1012, 1013, 1014, 1015, 1020, 1021,
      1031, 1032, 1033, 1034, 1035, 1036, 1037, 1038
    ],
    "excludedQuestIds": [
      1000, 1001, 1003, 1004, 1005, 1006, 1007, 1016, 1017, 1018,
      1019, 1022, 1025, 1026, 1027, 1028, 1029, 1030, 1039,
      1040, 1041, 1042, 1043, 1044, 1046, 8031, 8142
    ]
  },
  "route": [
    {
      "mapId": 10000,
      "label": "Mushroom Town",
      "objectives": [
        { "kind": "quest-chain", "questIds": [1031], "npcIds": [2101, 2100] }
      ]
    },
    {
      "mapId": 20000,
      "label": "Snail Garden",
      "objectives": [
        { "kind": "quest-start", "questId": 1021, "npcId": 2000 },
        { "kind": "use-item", "itemId": 2010007, "forQuestId": 1021 },
        { "kind": "quest-complete", "questId": 1021, "npcId": 2000 }
      ]
    },
    {
      "mapId": 30000,
      "label": "Snail Field of Flowers",
      "objectives": [
        { "kind": "quest-start", "questId": 1032, "npcId": 2102 }
      ]
    },
    {
      "mapId": 30001,
      "label": "Mushroom Town Townstreet",
      "objectives": [
        { "kind": "quest-complete", "questId": 1032, "npcId": 2001 },
        { "kind": "quest-start", "questId": 1033, "npcId": 2001 }
      ]
    },
    {
      "mapId": 30000,
      "label": "Snail Field of Flowers",
      "objectives": [
        { "kind": "quest-complete", "questId": 1033, "npcId": 2102 },
        { "kind": "quest-start", "questId": 1034, "npcId": 2102 }
      ]
    },
    {
      "mapId": 30001,
      "label": "Mushroom Town Townstreet",
      "objectives": [
        { "kind": "quest-complete", "questId": 1034, "npcId": 2001 }
      ]
    },
    {
      "mapId": 40000,
      "label": "Mushroom Town Training Ground",
      "objectives": [
        { "kind": "quest-start", "questId": 1035, "npcId": 2004 },
        { "kind": "kill-mobs", "forQuestId": 1035, "mobIds": [9300018], "counts": [1], "itemIds": [4031802] },
        { "kind": "quest-complete", "questId": 1035, "npcId": 2002 }
      ]
    },
    {
      "mapId": 50000,
      "label": "Dangerous Forest",
      "objectives": [
        { "kind": "quest-chain", "questIds": [1036], "npcId": 2003 },
        { "kind": "quest-start", "questId": 1037, "npcId": 2005 },
        { "kind": "kill-mobs", "forQuestId": 1037, "mobIds": [100100], "counts": [10] }
      ]
    },
    {
      "mapId": 1000000,
      "label": "Amherst",
      "objectives": [
        { "objectiveId": "r008-rain-1009-quest-chain", "kind": "quest-chain", "questIds": [1009], "npcId": 12101 },
        { "objectiveId": "r008-rain-1010-quest-chain", "kind": "quest-chain", "questIds": [1010], "npcId": 12101 },
        { "objectiveId": "r008-rain-1011-quest-chain", "kind": "quest-chain", "questIds": [1011], "npcId": 12101 },
        { "objectiveId": "r008-rain-1012-quest-chain", "kind": "quest-chain", "questIds": [1012], "npcId": 12101 },
        { "objectiveId": "r008-rain-1013-quest-chain", "kind": "quest-chain", "questIds": [1013], "npcId": 12101 },
        { "objectiveId": "r008-rain-1014-quest-chain", "kind": "quest-chain", "questIds": [1014], "npcId": 12101 },
        { "objectiveId": "r008-rain-1015-quest-chain", "kind": "quest-chain", "questIds": [1015], "npcId": 12101 },
        { "objectiveId": "r008-o000-quest-complete", "kind": "quest-complete", "questId": 1037, "npcId": 2103 },
        { "objectiveId": "r008-o001-quest-chain", "kind": "quest-chain", "questIds": [1038], "npcIds": [2103, 12000] },
        { "kind": "quest-start", "questId": 1008, "npcId": 10000 },
        { "kind": "reactor-hit", "forQuestId": 1008, "npcId": 10000, "mode": "hit" },
        { "kind": "reactor-box-items", "forQuestId": 1008, "itemIds": [4031161, 4031162] },
        { "kind": "quest-complete", "questId": 1008, "npcId": 10000 },
        { "kind": "quest-chain", "questIds": [1020], "npcId": 10000 },
        { "kind": "stop-plan", "mode": "relaxer", "reason": "Amherst sub-phase ends in Amherst before Training Center, Southperry, or Shanks travel." }
      ]
    }
  ]
}
